{
  "models": { "primary": "kimi", "reviewer": "gpt-4o", "fallback": [] },
  "tools": {
    "mcp": { "enabled": false },
    "n8n": { "enabled": false },
    "openai": { 
      "enabled": true,
      "model": "gpt-4.1",
      "max_tokens": 512
    },
    "kimi": { "enabled": false },
    "rag": { "enabled": false },
    "python": { "enabled": false },
    "google": { "enabled": false },
    "ui": { "enabled": false },
    "scraper": { "enabled": false },
    "memory": { "enabled": true }
  },
  "routingRules": [],
  "safety": { "paperTradeDefault": true, "needsApproval": [] }
}
